Style, Taylor Swift, , , , 1064019, 2358, 2014.10.27, Big Machine Records &  LLC., Universal Music, POP / 팝, 03:51
Hotline Bling, Drake, , , , 890516, 1944, 2016.05.06, Young Money Entertainment &  Cash Money Records, Universal Music, POP / 랩/힙합, 04:27
GDFR (Feat. Sage The Gemini And Lookas), Flo Rida, , , , 8202118, 9907, 2014.10.16, Atlantic Recording Corp., 워너뮤직, POP / 랩/힙합, 03:10
What Do You Mean?, Justin Bieber, , , , 8003074, 10134, 2015.11.14, Def Jam Recordings, Universal Music, POP / 팝, 03:26
Stitches, Shawn Mendes, , , , 266283, 667, 2015.04.16, , Universal Music, POP / 팝, 03:27
Talking Body, Tove Lo, , , , 278184, 569, 2014.09.29, , Universal Music, POP / 팝, 03:58
Jealous, Nick Jonas, , , , 431998, 1053, 2014.09.09, , Universal Music, POP / 팝, 03:42
Time of Our Lives, Pitbull & Ne-Yo, , , , 8334, 24, 2014.11.17, RCA Records, Sony Music, POP / 팝, 03:49
Locked Away (Feat. Adam Levine), R. City, , , , 563711, 1197, 2015.06.29, Kemosabe Records &  RCA Records, Sony Music, POP / 팝, 03:47
Somebody (Feat. Jeremih), Natalie La Rose, , , , 550027, 1368, 2015.01.07, , Universal Music, POP / 팝, 03:10
FourFiveSeconds, Rihanna and Kanye West and Paul McCartney, , , , 486087, 1159, 2015.01.27, , Universal Music, POP / 팝, 03:08
My Way (Feat. Monty), Fetty Wap, , , , 156864, 224, 2015.07.17, 300 Entertainment &  RGF Productions, 워너뮤직, POP / 랩/힙합, 03:33
Take Your Time, Sam Hunt, , , , 189611, 552, 2015.02.25, , Universal Music, POP / 블루스/포크/컨트리, 04:04
Animals, Maroon 5, , , , 55960, 98, 2014.08.25, Interscope Records, Universal Music, POP / 락, 03:49
Bitch Better Have My Money, Rihanna, , , , 1302870, 2533, 2015.03.30, , Universal Music, POP / R&B/소울, 03:39
Nasty Freestyle, T-Wayne, , , , 185135, 278, 2015.05.11, Unauthorized Entertainment, 워너뮤직, POP / 랩/힙합, 02:22
Only (Feat. Lil Wayne & Chris Brown & Drake), Nicki Minaj, , , , 102988, 249, 2014.12.15, , Universal Music, POP / 랩/힙합, 05:12
Elastic Heart, Sia, , , , 1101230, 1685, 2014.07.07, Monkey Puzzle Records &  RCA Records, Sony Music, POP / 팝, 04:17
Cool For The Summer, Demi Lovato, , , , 90000, 160, 2015.10.16, Hollywood Records &  Inc. & Island Records &  a division of UMG Recordings &  Inc., Universal Music, POP / 팝, 03:35
Renegades, X Ambassadors, , , , 132183, 424, 2015.06.30, Universal Music Ltd., Universal Music, POP / 락, 03:15
Love Me Harder, Ariana Grande & The Weeknd, , , , 1369180, 2326, 2014.12.08, , Universal Music, POP / 팝, 03:56
Wildest Dreams, Taylor Swift, , , , 784420, 2168, 2014.10.27, Big Machine Records &  LLC., Universal Music, POP / 팝, 03:40
Stay With Me, Sam Smith, , , , 54334, 83, 2014.05.19, Universal Music Ltd., Universal Music, POP / R&B/소울, 02:53
You Know You Like It, DJ Snake & AlunaGeorge, , , , 229841, 494, 2014.12.08, , Universal Music, POP / 일렉트로니카, 04:07
Uma Thurman, Fall Out Boy, , , , 281958, 580, 2015.01.20, Universal Music Ltd., Universal Music, POP / 락, 03:32
7/11, Beyonce, , , , 1210473, 1685, 2014.12.01, Parkwood Entertainment &  Columbia, Sony Music, POP / 랩/힙합, 03:34
The Heart Wants What It Wants, Selena Gomez, , , , 317144, 688, 2014.11.11, , Universal Music, POP / 팝, 03:47
Girl Crush, Little Big Town, , , , 71554, 148, 2014.10.20, Little Big Town &  LLC, Universal Music, POP / 블루스/포크/컨트리, 03:13
Slow Motion, Trey Songz, , , , 593767, 1346, 2015.01.15, Songbook &  Atlantic, 워너뮤직, POP / R&B/소울, 03:18
Truffle Butter (Feat. Lil Wayne & Drake), Nicki Minaj, , , , 322591, 552, 2015.02.03, , Universal Music, POP / 랩/힙합, 03:39
One Last Time, Ariana Grande, , , , 3415153, 5922, 2014.08.25, , Universal Music, POP / 팝, 03:17
Chains, Nick Jonas, , , , 18214, 33, 2014.08.04, , Universal Music, POP / 팝, 03:23
All Eyes On You (Feat. Chris Brown & Nicki Minaj), Meek Mill, , , , 227151, 579, 2015.07.09, MMG &  Atlantic, 워너뮤직, POP / 랩/힙합, 03:44
No Type, Rae Sremmurd, , , , 411688, 689, 2015.01.06, , Universal Music, POP / 랩/힙합, 03:20
Riptide, Vance Joy, , , , 24967, 81, 2013.05.31, Atlantic Recording Corp., 워너뮤직, POP / 블루스/포크/컨트리, 03:24
Classic Man (Feat. Roman GianArthur), Jidenna, , , , 53174, 121, 2015.02.03, Epic Records, Sony Music, POP / 랩/힙합, 03:46
Ex's & Oh's, Elle King, , , , 90533, 233, 2014.09.23, RCA Records Label, Sony Music, POP / 팝, 03:22
Dear Future Husband, Meghan Trainor, , , , 1203242, 2515, 2014.09.09, Epic Records, Sony Music, POP / 팝, 03:04
Marvin Gaye (Feat. Meghan Trainor), Charlie Puth, , , , 1272233, 2815, 2015.05.06, Artist Partners, 워너뮤직, POP / 팝, 03:08
Like I'm Gonna Lose You (Feat. John Legend), Meghan Trainor, , , , 134984, 327, 2015.01.12, Epic, Sony Music, POP / 팝, 03:45
Habits (Stay High), Tove Lo, , , , 470624, 1188, 2014.09.29, , Universal Music, POP / 팝, 03:29
The Hanging Tree (Feat. Jennifer Lawrence), James Newton Howard, , , , 52525, 241, 2014.12.01, Republic Records &  a division of UMG Recordings &  Inc., Universal Music, OST / 전체, 03:39
CoCo, O.T. Genasis, , , , 981611, 1471, 2014.12.26, The Conglomerate Entertainment &  Atlantc Records, 워너뮤직, POP / 랩/힙합, 04:00
Lay Me Down, Sam Smith, , , , 9925500, 12057, 2014.05.27, Universal Music Ltd., Universal Music, POP / 팝, 04:13
Tuesday (Feat. Drake), I LOVE MAKONNEN, , , , 41826, 132, 2014.09.05, OVO Sound &  Warner Bros., 워너뮤직, POP / R&B/소울, 05:22
Hit the Quan (Original Ver.), iLoveMemphis, , , , 121083, 191, 2015.10.16, Records &  LLC, Sony Music, POP / 랩/힙합, 03:01
Downtown (Feat. Eric Nally & Melle Mel & Kool Moe Dee & Grandmaster Caz), Macklemore & Ryan Lewis, , , , 202645, 541, 2015.08.28, Macklemore, 워너뮤직, POP / 랩/힙합, 04:53
House Party, Sam Hunt, , , , 5054, 4, 2014.08.12, MCA Nashville &  a Division of UMG Recordings &  Inc., Universal Music, POP / 블루스/포크/컨트리, 03:10
Ayo, Chris Brown X Tyga, , , , 1564365, 2242, 2015.01.09, RCA Records Label, Sony Music, POP / R&B/소울, 03:46
Kick The Dust Up, Luke Bryan, , , , 7347, 14, 2015.08.07, Universal Music Ltd., Universal Music, POP / 블루스/포크/컨트리, 03:11
Budapest, George Ezra, , , , 29485, 44, 2013.11.03, Columbia, Sony Music, POP / 팝, 03:22
Chandelier, Sia, , , , 1615938, 1984, 2014.03.17, Monkey Puzzle Records, Sony Music, POP / 팝, 03:36
Heartbeat Song, Kelly Clarkson, , , , 434964, 821, 2015.01.12, 19 Recordings Limited Under Exclusive License To RCA Records, Sony Music, POP / 팝, 03:19
Don't, Ed Sheeran, , , , 1668652, 3186, 2014.06.20, Atlantic Records UK, 워너뮤직, POP / 팝, 03:40
Ghost, Ella Henderson, , , , 162005, 362, 2014.06.24, Syco Music, Sony Music, POP / 팝, 03:36
Waves, Mr. Probz, , , , 62393, 162, 2013.11.22, Left Lane Recordings, FUGA, POP / 팝, 02:54
She Knows (Feat. Juicy J), Ne-Yo, , , , 164168, 253, 2015.02.16, , Universal Music, POP / R&B/소울, 03:35
Night Changes, One Direction, , , , 594767, 1816, 2014.11.17, Simco Limited UK Limited, Sony Music, POP / 팝, 03:47
Back To Back, Drake, , , , 299801, 594, 2015.08.04, Universal Music Ltd., Universal Music, POP / 랩/힙합, 02:51
How Deep is Your Love (Feat. Disciples), Calvin Harris, , , , 2410425, 3542, 2015.07.20, Columbia, Sony Music, POP / 전체, 03:33
썸 (Feat. 긱스 릴보이), 소유 (SOYOU) & 정기고, , , , 42539787, 19755, 2014.02.07, (주)스타쉽 엑스, 카카오엔터테인먼트, 가요 / R&B/소울, 03:32
눈 코 입, 태양, , , , 31920819, 21962, 2014.06.03, (주)YG엔터테인먼트, YG PLUS, 가요 / R&B/소울, 03:50
야생화, 박효신, 박효신 & 정재일, 박효신 & 김지향, 정재일, 72206389, 51669, 2014.03.28, 젤리피쉬 엔터테인먼트, 카카오엔터테인먼트, 가요 / 발라드, 05:12
짧은 치마 (Miniskirt), AOA, 용감한형제 & 차쿤  & 코끼리왕국, 차쿤  & 용감한형제, , 19487111, 7775, 2014.01.16, FNC엔터테인먼트, 카카오엔터테인먼트, 가요 / 댄스, 03:00
너의 의미 (Feat. 김창완), 아이유 (IU), 김한영, , 김창완, 43857725, 32736, 2014.05.16, 카카오엔터테인먼트, 카카오엔터테인먼트, 가요 / 발라드, 03:16
Come Back Home, 2NE1, , , , 15289926, 8338, 2014.02.27, (주)YG엔터테인먼트, YG PLUS, 가요 / 댄스, 03:50
Mr. Chu (On Stage), Apink (에이핑크), 이단옆차기 & SEION, 이단옆차기 & Dayday (데이데이), 영광의 얼굴들 (Full8loom), 23684005, 12402, 2014.03.31, 에이큐브 엔터테인먼트, 카카오엔터테인먼트, 가요 / 댄스, 03:25
한여름밤의 꿀, San E & 레이나, 코스믹 사운드 & 산이 (San E), 산이 (San E), 코스믹 사운드, 43414193, 25659, 2014.06.12, 플레디스 엔터테인먼트 &  브랜뉴뮤직, 카카오엔터테인먼트, 가요 / 랩/힙합, 03:53
200％, AKMU (악뮤), 이찬혁, 이찬혁, 이찬혁 & 로빈(ROVIN), 32300141, 20583, 2014.04.07, (주)YG엔터테인먼트, YG PLUS, 가요 / 전체, 03:14
Something, 걸스데이 (Girl's Day), , , , 16657494, 6820, 2014.01.03, ㈜인터파크, ㈜인터파크, 가요 / 댄스, 03:21
그 중에 그대를 만나, 이선희, , , , 26618014, 20849, 2014.03.25, (주)후크엔터테인먼트, (주)후크엔터테인먼트, 가요 / 발라드, 03:46
노래가 늘었어, 에일리 (Ailee), 휘성 (Realslow) & 문하, 휘성 (Realslow), 문하 & 두리 (SFRM), 21173293, 12774, 2014.01.06, YMC엔터테인먼트㈜, 카카오엔터테인먼트, 가요 / R&B/소울, 03:20
중독 (Overdose), EXO-K, , , , 17121585, 19365, 2014.05.07, SM ENTERTAINMENT, Dreamus, 가요 / 댄스, 03:26
공허해, WINNER, B.I & PK, B.I & MINO (송민호) & BOBBY, PK, 26784313, 26709, 2014.08.12, (주)YG엔터테인먼트, YG PLUS, 가요 / 랩/힙합, 03:40
봄 사랑 벚꽃 말고, HIGH4 & 아이유, , , , 47416042, 27115, 2014.04.08, 엔에이피엔터테인먼트, 카카오엔터테인먼트, 가요 / 발라드, 03:15
까탈레나 (Catallena), 오렌지캬라멜 (ORANGE CARAMEL), , , , 13292150, 6428, 2014.03.12, 플레디스 엔터테인먼트, 카카오엔터테인먼트, 가요 / 댄스, 03:13
사람냄새, 정인 & 개리, , , , 22646379, 12952, 2014.05.27, 리쌍컴퍼니, 카카오엔터테인먼트, 가요 / R&B/소울, 03:29
견딜만해 (Feat. 효린 (씨스타)), 매드 클라운 (Mad Clown), 매드 클라운 (Mad Clown) & Dokkun (김도훈) & 에스나 (eSNa) & 민연재, , Dokkun (김도훈) & 에스나 (eSNa), 12316559, 6340, 2014.04.04, (주)스타쉽 엑스, 카카오엔터테인먼트, 가요 / 랩/힙합, 03:46
단발머리 (Short Hair), AOA, , , , 17549775, 7741, 2014.06.19, FNC엔터테인먼트, 카카오엔터테인먼트, 가요 / 댄스, 03:35
HER, 블락비 (Block B), 지코 (ZICO) & Poptime, 지코 (ZICO), 지코 (ZICO) & Poptime, 28972440, 41304, 2014.07.24, 세븐시즌스 &  Stone Music Entertainment, 지니뮤직 &  Stone Music Entertainment, 가요 / 댄스, 02:59
금요일에 만나요 (Feat. 장이정 of HISTORY), 아이유 (IU), 아이유 (IU), , 아이유 (IU), 60562366, 39559, 2013.12.20, 카카오엔터테인먼트, 카카오엔터테인먼트, 가요 / 전체, 03:37
My Destiny, 린 (LYn), , , , 13939512, 7879, 2013.12.26, ㈜SBS콘텐츠허브 (㈜에스비에스콘텐츠허브), NHN벅스, OST / 드라마, 03:52
너를 너를 너를, 플라이 투 더 스카이, , , , 17538011, 10428, 2014.05.20, 에이치투미디어, 카카오엔터테인먼트, 가요 / R&B/소울, 04:20
잠 못드는 밤 (Feat. 펀치 (Punch)), Crush, 지훈 & 구지안, , 베리 (Rocoberry), 19587289, 16969, 2014.08.06, Stone Music Entertainment &  가지컨텐츠, 지니뮤직 &  Stone Music Entertainment, OST / 드라마, 03:58
너 사용법, 에디킴, 에디킴, 에디킴, 조정치, 26048293, 18497, 2014.04.11, ㈜미스틱89 (MYSTIC89), 카카오엔터테인먼트, 가요 / 블루스/포크, 03:02
Touch My Body, 씨스타 (Sistar), 블랙아이드필승, 블랙아이드필승, Rado, 26456175, 13209, 2014.07.21, 스타쉽 엔터테인먼트, 카카오엔터테인먼트, 가요 / 댄스, 03:27
안녕, 효린, , , , 15530151, 10282, 2014.01.22, ㈜SBS콘텐츠허브 (㈜에스비에스콘텐츠허브), NHN벅스, OST / 드라마, 03:39
Give Love, AKMU (악뮤), 이찬혁, 이찬혁, 서기 & 신승익, 23816957, 17272, 2014.04.07, (주)YG엔터테인먼트, YG PLUS, 가요 / 전체, 02:57
너를 원해 (Feat. Beenzino), 정기고 (Junggigo), , , , 12212500, 5295, 2014.05.09, (주)스타쉽 엑스, 카카오엔터테인먼트, 가요 / 랩/힙합, 03:13
예뻐졌다 (Feat. 지코 of Block B), 박보람, , , , 21537265, 13204, 2014.08.07, Stone Music Entertainment &  FRON+DESK, 지니뮤직, 가요 / 발라드, 03:30
보름달 (Feat. Lena), 선미, , , , 17769847, 10337, 2014.02.17, (주)JYP엔터테인먼트, Dreamus, 가요 / 댄스, 03:22
감아 (Feat. Crush), 로꼬, 로꼬 & Crush, , GRAY (그레이) & Crush, 26112950, 19778, 2014.03.19, AOMG, 카카오엔터테인먼트, 가요 / 랩/힙합, 03:50
연결고리#힙합, BOBBY, , , , 15260599, 12837, 2014.08.29, Stone Music Entertainment, 지니뮤직, 가요 / 랩/힙합, 04:01
신촌을 못가, 포스트맨 (Postmen), , , , 29359907, 18610, 2013.01.21, Good fellas Entertainment, 카카오엔터테인먼트, 가요 / 발라드, 03:46
흔한 노래, 임창정, 수퍼터치, 임창정, 수퍼터치, 17357166, 9163, 2014.03.20, nhemg (㈜앤에이취이엠쥐), 케미컬레코드, 가요 / 발라드, 04:07
나 왜이래 (Feat. 강민희 of 미스에스), 산이 (San E), , , , 12682375, 6743, 2014.05.29, 리웨이뮤직앤미디어, 피앤엠코리아, OST / 드라마, 03:20
Mr.Mr., 소녀시대 (GIRLS' GENERATION), The Underdogs, 조윤경 & 김희정, The Underdogs, 12142979, 9250, 2014.02.24, SM ENTERTAINMENT, Dreamus, 가요 / 댄스, 03:57
너를 사랑해, 윤미래, , , , 18702995, 16638, 2014.08.27, Stone Music Entertainment &  가지컨텐츠, 지니뮤직 &  Stone Music Entertainment, OST / 드라마, 04:03
너 아님 안돼, 2NE1, , , , 10305445, 5866, 2014.02.27, (주)YG엔터테인먼트, YG PLUS, 가요 / 댄스, 03:52
나의 옛날이야기, 아이유 (IU), 조덕배, 조덕배, 제휘, 24363867, 22738, 2014.05.16, 카카오엔터테인먼트, 카카오엔터테인먼트, 가요 / 발라드, 03:34
자니 (Feat. DYNAMICDUO), 프라이머리, 다이나믹 듀오, , 프라이머리 & 개코, 27451789, 21430, 2012.03.07, 아메바컬쳐, 지니뮤직 &  Stone Music Entertainment, 가요 / 랩/힙합, 03:54
빨개요, 현아, , , , 9620640, 5429, 2014.07.28, 큐브 엔터테인먼트, 카카오엔터테인먼트, 가요 / 댄스, 03:20
너에게, 성시경, 서태지, 서태지, MELODESIGN, 25228640, 16582, 2013.11.01, Stone Music Entertainment, 지니뮤직, OST / 드라마, 03:51
오늘부터 1일 (Day 1), 케이윌 (K.Will), , , , 20313067, 12358, 2014.06.26, 스타쉽 엔터테인먼트, 카카오엔터테인먼트, 가요 / 발라드, 03:26
LA SONG, 비, , 배진렬 (JR Groove), , 5468843, 2675, 2014.01.02, 레인컴퍼니, 카카오엔터테인먼트, 가요 / 댄스, 03:15
괜찮아 사랑이야, 다비치, 베리 (Rocoberry), 지훈 & 구지안, 베리 (Rocoberry), 21547860, 16988, 2014.07.30, Stone Music Entertainment &  가지컨텐츠, 지니뮤직 &  Stone Music Entertainment, OST / 드라마, 04:05
가슴 시린 이야기 (Feat. 용준형 of BEAST), 휘성 (Realslow), Dokkun (김도훈), , , 16590916, 8974, 2011.03.15, 노미네이트, 지니뮤직 &  Stone Music Entertainment, 가요 / 발라드, 03:20
너에게만, 범키 & 버벌진트, , 이현도, , 7375305, 4735, 2013.12.16, (주)제이원파트너스 &  카카오엔터테인먼트, 카카오엔터테인먼트, 가요 / 랩/힙합, 03:19
애타는 마음, 울랄라세션 & 아이유, , , , 18247123, 13338, 2014.06.30, 엔에이피엔터테인먼트, 카카오엔터테인먼트, 가요 / 전체, 03:33
살아 봤으면 해, 2NE1, , , , 11348403, 7217, 2014.02.27, (주)YG엔터테인먼트, YG PLUS, 가요 / R&B/소울, 03:30
별처럼, 케이윌 (K.Will), , 김세진, , 7464846, 3535, 2014.01.08, ㈜SBS콘텐츠허브 (㈜에스비에스콘텐츠허브), NHN벅스, OST / 드라마, 03:30
조금 이따 샤워해 (Feat. Crush), 개리, GRAY (그레이), , , 7830513, 4215, 2014.01.15, 리쌍컴퍼니, 카카오엔터테인먼트, 가요 / 랩/힙합, 04:00
으르렁 (Growl), EXO, Hyuk Shin (153/Joombas) & John Major & Jordan Kyle & Jarah Gibson & DK, 서지음, Hyuk Shin (153/Joombas) & Jordan Kyle & John Major, 18301879, 23437, 2013.08.05, SM ENTERTAINMENT, Dreamus, 가요 / 댄스, 03:27
답이 없었어, 홍대광, , , , 8776167, 6288, 2014.03.21, Stone Music Entertainment &  MMO Entertainment, 지니뮤직, 가요 / 발라드, 04:04
Can't Stop, CNBLUE (씨엔블루), , , , 6497471, 4081, 2014.02.24, FNC엔터테인먼트, 카카오엔터테인먼트, 가요 / 락, 03:58
손대지마, 에일리 (Ailee), Dokkun (김도훈) & 서재우, 민연재 & Jakops, Dokkun (김도훈) & 서재우, 18366534, 13248, 2014.09.25, YMC엔터테인먼트㈜, 카카오엔터테인먼트, 가요 / 전체, 03:24
뜨래요 (Feat. 앙리 of 3B), 배치기, , , , 9154848, 3956, 2014.03.24, YMC엔터테인먼트㈜, NHN벅스, 가요 / 랩/힙합, 03:26
우산, 윤하 (YOUNHA), , , , 16494216, 15147, 2014.07.02, C9 ENTERTAINMENT &  Stone Music Entertainment, 지니뮤직 &  Stone Music Entertainment, 가요 / 발라드, 04:53
티가 나나봐, 15& (박지민 &  백예린), , , , 9372522, 4975, 2014.04.13, (주)JYP엔터테인먼트, Dreamus, 가요 / R&B/소울, 03:05
Darling, 걸스데이 (Girl's Day), , , , 18060587, 10281, 2014.07.14, ㈜인터파크, ㈜인터파크, 가요 / 댄스, 03:14
틈, 소유 (SOYOU) & 권순일 (어반자카파) & 박용인 (어반자카파), , , , 13731777, 9612, 2014.09.26, (주)스타쉽 엑스, 카카오엔터테인먼트, 가요 / R&B/소울, 03:31
Fxxk U (Feat. 범키), 가인, , , , 6348631, 3883, 2014.02.06, 에이팝엔터테인먼트, 카카오엔터테인먼트, 가요 / R&B/소울, 03:37
얼음들, AKMU (악뮤), 이찬혁, 이찬혁, 이찬혁 & 로빈, 9819060, 7549, 2014.04.07, (주)YG엔터테인먼트, YG PLUS, 가요 / 전체, 03:56
오늘 같은 눈물이, 허각, , , , 6752610, 2476, 2014.02.05, ㈜SBS콘텐츠허브 (㈜에스비에스콘텐츠허브), NHN벅스, OST / 드라마, 03:52
이제 그만 싸우자, 허각 & 정은지 (Apink), , , , 10198864, 5931, 2014.07.08, 에이큐브 엔터테인먼트, 카카오엔터테인먼트, 가요 / 발라드, 04:23
그게 나야, 김동률, , , , 16698456, 16467, 2014.10.01, 뮤직팜, 카카오엔터테인먼트, 가요 / 발라드, 04:45
착해 빠졌어 (Stupid In Love), 소유 (SOYOU) & 매드 클라운 (Mad Clown), Dokkun (김도훈), 매드 클라운 (Mad Clown) & 민연재, Dokkun (김도훈) & 박수종, 17636845, 11491, 2013.09.10, (주)스타쉽 엑스, 카카오엔터테인먼트, 가요 / 랩/힙합, 04:10
오늘 뭐해, 4minute (포미닛), , , , 5571353, 2129, 2014.03.17, 큐브 엔터테인먼트, 카카오엔터테인먼트, 가요 / 댄스, 03:26
그대가 분다, 엠씨더맥스 (M.C the MAX), 최성일 & 이세환, 최성일 & 민연재, 최성일, 26499253, 13748, 2014.01.02, (주)뮤직앤뉴, 뮤직앤뉴, 가요 / 발라드, 03:59
하늘색 약속, 지오디 (god), , , , 9880478, 6822, 2014.07.08, sidus HQ &  god, 카카오엔터테인먼트, 가요 / 전체, 04:04
헤픈엔딩 (Feat. 조원선 of 롤러코스터), 에픽하이 (EPIK HIGH), , , , 19284173, 18190, 2014.10.21, (주)YG엔터테인먼트, YG PLUS, 가요 / 랩/힙합, 04:24
그런 남자, Bro, , , , 8533780, 3798, 2014.03.21, 돌직구뮤직, Place Music, 가요 / 발라드, 03:42
Body Language (Feat. 범키), 산이 (San E), , , , 11086229, 6991, 2014.08.04, 브랜뉴뮤직 (Brand New Music), 카카오엔터테인먼트, 가요 / 랩/힙합, 03:37
사랑이 지나가면, 아이유 (IU), 이영훈, 이영훈, G.고릴라, 14143915, 13014, 2014.05.16, 카카오엔터테인먼트, 카카오엔터테인먼트, 가요 / 발라드, 04:01
헤어졌다 만났다, 다비치, 용감한형제 & 코끼리왕국, 용감한형제, 용감한형제 & 코끼리왕국  & 이정민, 7726684, 3088, 2014.06.05, Beyond Music, Dreamus, 가요 / 댄스, 03:07
I Swear, 씨스타 (Sistar), 이단옆차기 & 영광의 얼굴들 (Full8loom), 이단옆차기, 이단옆차기 & 영광의 얼굴들 (Full8loom), 17124587, 11025, 2014.08.26, 스타쉽 엔터테인먼트, 카카오엔터테인먼트, 가요 / 댄스, 03:57
LONELY (없구나), B1A4, , , , 7155006, 10086, 2014.01.13, WM엔터테인먼트, (주)래드컴, 가요 / 댄스, 04:05
썸남썸녀 (Feat. 휘성), 케이윌 & 마마무(Mamamoo), , , , 7163892, 4242, 2014.02.11, (주)RBW, 카카오엔터테인먼트, 가요 / 댄스, 03:30
Good-night Kiss, 전효성, , , , 7362410, 3443, 2014.05.12, (주)RBW, (주)래드컴, 가요 / 댄스, 03:26
소주 한 잔, 임창정, 이동원, 임창정, , 32420817, 24656, 2003.06.05, WM Korea, 워너뮤직, 가요 / 전체, 04:51
Night and Day, 휘성 (Realslow), , , , 6394373, 2940, 2014.05.12, YMC엔터테인먼트㈜, NHN벅스, 가요 / R&B/소울, 03:38
JACKPOT, 블락비 (Block B), 지코 (ZICO) & Poptime, 지코 (ZICO), 지코 (ZICO) & Poptime, 14133411, 20687, 2014.07.24, 세븐시즌스 &  Stone Music Entertainment, 지니뮤직 &  Stone Music Entertainment, 가요 / 댄스, 03:13
Good Luck, 비스트 (Beast), , , , 10943974, 13983, 2014.06.16, 큐브 엔터테인먼트, 카카오엔터테인먼트, 가요 / 댄스, 03:22
끝사랑, 김범수, , 윤일상, , 21356475, 17112, 2011.06.16, 폴라리스 엔터테인먼트, 카카오엔터테인먼트, 가요 / 발라드, 04:12
당신만이, 곽진언 & 김필 & 임도혁, , , , 10128598, 8912, 2014.09.20, Stone Music Entertainment, 지니뮤직, 가요 / 발라드, 04:18
독기, 아이언, , , , 12116216, 9744, 2014.09.04, Stone Music Entertainment, 지니뮤직, 가요 / 랩/힙합, 03:19
미운오리새끼, 지오디 (god), , , , 3699161, 3464, 2014.07.08, sidus HQ &  god, 카카오엔터테인먼트, 가요 / 전체, 04:24
벚꽃 엔딩, 버스커 버스커 (Busker Busker), , , , 50500115, 40322, 2012.03.29, Stone Music Entertainment, 지니뮤직, 가요 / 락, 04:21
너무 보고싶어, 어쿠스틱 콜라보, 빨간양말, 빨간양말, 빨간양말, 42467860, 33027, 2014.09.18, Mog Communications (모그커뮤니케이션즈), 카카오엔터테인먼트, OST / 드라마, 04:04
시간과 낙엽, AKMU (악뮤), 이찬혁, 이찬혁, philtre, 13731016, 17222, 2014.10.10, (주)YG엔터테인먼트, YG PLUS, 가요 / 발라드, 04:08
숨소리 (Breath) (Sung by 태연 (소녀시대) & 종현 (샤이니)), S.M. THE BALLAD, , , , 7470933, 7923, 2014.02.10, SM ENTERTAINMENT, Dreamus, 가요 / 발라드, 04:37
끼부리지마, WINNER, 강욱진 & 함승천 & iHwak, 강욱진 & 함승천 & iHwak & MINO (송민호) & 이승훈, 강욱진 & 함승천, 16267928, 16897, 2014.08.12, (주)YG엔터테인먼트, YG PLUS, 가요 / 전체, 03:25
Love Fiction, 울랄라세션, , , , 12566067, 12081, 2014.08.21, Stone Music Entertainment &  가지컨텐츠, 지니뮤직 &  Stone Music Entertainment, OST / 드라마, 03:39
Good Morning Baby, Apink (에이핑크), 이단옆차기, 이단옆차기, 텐조와 타스코, 6215180, 4559, 2014.01.13, 에이큐브 엔터테인먼트, 카카오엔터테인먼트, 가요 / 댄스, 03:45
Dali Van Picasso, 빈지노 (Beenzino), PEEJAY, 빈지노 (Beenzino), , 14777849, 12134, 2013.12.18, ILLIONAIRE RECORDS (일리네어 레코즈), 지니뮤직 &  Stone Music Entertainment, 가요 / 랩/힙합, 03:44
처음엔 사랑이란게, 버스커 버스커 (Busker Busker), 장범준, 장범준, 장범준 & 배영준, 19610180, 12752, 2013.09.25, ㈜청춘뮤직 &  Stone Music Entertainment, 지니뮤직 &  Stone Music Entertainment, 가요 / 락, 04:02
거짓말 거짓말 거짓말, 이적, 이적, 이적, 이적 & 양시온, 17124627, 16459, 2013.11.15, 뮤직팜, 카카오엔터테인먼트, 가요 / 발라드, 04:33
12시 30분, 비스트 (Beast), , , , 20664915, 17308, 2014.10.20, 큐브 엔터테인먼트, 카카오엔터테인먼트, 가요 / R&B/소울, 03:54
Happy (From 'Despicable Me 2'), Pharrell Williams, , , , 172679, 378, 2014.03.03, Columbia Records, Sony Music, POP / 팝, 03:53
Dark Horse (Feat. Juicy J), Katy Perry, , , , 610887, 1438, 2013.10.21, , Universal Music, POP / 팝, 03:36
All Of Me, John Legend, , , , 776850, 1788, 2013.08.09, G.O.O.D. Music &  Columbia, Sony Music, POP / R&B/소울, 04:30
Fancy (Feat. Charli XCX), Iggy Azalea, , , , 36337, 136, 2014.11.24, Universal Music Ltd., Universal Music, POP / 랩/힙합, 03:20
Counting Stars, OneRepublic, , , , 907306, 1750, 2013.03.25, Universal Music Ltd., Universal Music, POP / 락, 04:17
Talk Dirty (Feat. 2 Chainz), Jason Derulo, , , , 2505178, 2857, 2013.08.22, Warner Brothers.thers, 워너뮤직, POP / R&B/소울, 02:58
Rude, MAGIC!, , , , 1238676, 2747, 2013.10.11, Latium Records &  RCA Records, Sony Music, POP / 팝, 03:45
Problem (Feat. Iggy Azalea), Ariana Grande, , , , 984327, 2250, 2014.08.25, , Universal Music, POP / 팝, 03:14
Stay With Me, Sam Smith, , , , 1154072, 1336, 2015.11.08, Capitol Records Ltd., Universal Music, POP / R&B/소울, 02:53
Timber (Feat. Ke$ha), Pitbull, , , , 6702067, 6757, 2013.10.07, RCA Records, Sony Music, POP / 팝, 03:24
Pompeii, Bastille, , , , 30933, 75, 2013.02.26, Universal Music Ltd., Universal Music, POP / 락, 03:34
Am I Wrong, Nico & Vinz, , , , 410948, 886, 2014.04.21, Warner Brothers., 워너뮤직, POP / 팝, 04:07
Turn Down for What, Dj Snake & Lil Jon, , , , 7454027, 7968, 2013.12.19, Columbia, Sony Music, POP / 랩/힙합, 03:34
The Monster (Feat. Rihanna), Eminem, , , , 512569, 1136, 2013.11.05, , Universal Music, POP / 랩/힙합, 04:10
Say Something, A Great Big World & Christina Aguilera, , , , 1213646, 2826, 2013.11.05, Epic, Sony Music, POP / 팝, 03:49
